number,value,datetime_start,datetime_complete,duration,params_batch_size,params_conv_filters,params_dense_units,params_dropout,params_gru_units,params_kernel_size,params_learning_rate,params_loss,state
0,0.8577933533290486,2026-10-02 13:40:22.441452,2026-10-02 13:41:31.108101,0 days 00:01:08.666649,2048,16,16,0.15502135295603015,128,3,0.0008605034792033113,sqrt_weighted,COMPLETE
1,0.8578081758893011,2026-10-02 13:41:31.108881,2026-10-02 13:44:17.318636,0 days 00:02:46.209755,4096,64,16,0.384665661176,64,3,0.0010113296398644534,ce,COMPLETE
2,0.8571332482307468,2026-10-02 13:44:17.323430,2026-10-02 13:45:24.204773,0 days 00:01:06.881343,4096,32,64,0.3325398470083344,32,3,0.000706827125296226,ce,COMPLETE
3,0.8581155551155372,2026-10-02 13:45:24.205326,2026-10-02 13:46:51.754516,0 days 00:01:27.549190,2048,64,32,0.3960660809801553,128,5,0.0016131122759154171,ce,COMPLETE
4,0.8575588949910014,2026-10-02 13:46:51.754734,2026-10-02 13:48:58.263633,0 days 00:02:06.508899,2048,16,64,0.29126724140656396,32,5,0.00030469718828990714,ce,COMPLETE
5,0.856044082521066,2026-10-02 13:48:58.264279,2026-10-02 13:49:43.391976,0 days 00:00:45.127697,4096,16,64,0.1747876687446625,128,3,0.00041999810856132414,sqrt_weighted,PRUNED
6,0.8579507737756032,2026-10-02 13:49:43.394102,2026-10-02 13:52:25.161337,0 days 00:02:41.767235,4096,16,32,0.13301557735830305,64,3,0.0005710550903217013,sqrt_weighted,COMPLETE
7,0.8580433285588451,2026-10-02 13:52:25.162102,2026-10-02 13:54:02.295692,0 days 00:01:37.133590,2048,16,32,0.17553468874760925,128,5,0.0029964813129021847,ce,COMPLETE
8,0.8580137336026928,2026-10-02 13:54:02.296283,2026-10-02 13:56:17.811222,0 days 00:02:15.514939,4096,64,32,0.3184649045835579,64,3,0.0006685798086644514,sqrt_weighted,COMPLETE
9,0.8569156034366596,2026-10-02 13:56:17.811816,2026-10-02 13:56:41.923834,0 days 00:00:24.112018,8192,16,64,0.21602060389016126,64,5,0.001783194597313636,ce,PRUNED
10,0.8581732657047954,2026-10-02 13:56:41.924263,2026-10-02 13:59:30.521951,0 days 00:02:48.597688,8192,64,32,0.3919113282308875,128,5,0.004386444776520478,ce,COMPLETE
11,0.8581691876551131,2026-10-02 13:59:30.522508,2026-10-02 14:03:01.682967,0 days 00:03:31.160459,8192,64,32,0.39901583045989386,128,5,0.004306906457288554,ce,COMPLETE
12,0.8580718654464428,2026-10-02 14:03:01.683535,2026-10-02 14:04:12.595079,0 days 00:01:10.911544,8192,64,32,0.3612013713432307,128,5,0.004874198235792113,ce,COMPLETE
13,0.8581077952220122,2026-10-02 14:04:12.595635,2026-10-02 14:06:05.348680,0 days 00:01:52.753045,8192,64,32,0.26931100380491907,128,5,0.004842977466842021,ce,COMPLETE
14,0.8581593241990056,2026-10-02 14:06:05.349395,2026-10-02 14:09:01.607503,0 days 00:02:56.258108,8192,32,32,0.35031891775487667,128,5,0.0028467029219629582,ce,COMPLETE
15,0.8595948907930436,2026-10-02 14:09:01.608050,2026-10-02 14:12:32.778101,0 days 00:03:31.170051,8192,64,32,0.23878584532599914,128,5,0.003014123716627415,ce,COMPLETE
16,0.8570987653709746,2026-10-02 14:12:32.778689,2026-10-02 14:13:04.246996,0 days 00:00:31.468307,8192,64,16,0.22001679486944772,32,5,0.002671780878843401,ce,PRUNED
17,0.8581901608491267,2026-10-02 14:13:04.247211,2026-10-02 14:15:54.033140,0 days 00:02:49.785929,8192,64,32,0.10395376431427714,128,5,0.001993028137706483,ce,COMPLETE
18,0.8432531904670568,2026-10-02 14:15:54.033804,2026-10-02 14:16:42.606636,0 days 00:00:48.572832,8192,32,32,0.1108914439696356,128,5,0.0016262830746114987,sqrt_weighted,PRUNED
19,0.8574333037913991,2026-10-02 14:16:42.607037,2026-10-02 14:17:16.534684,0 days 00:00:33.927647,8192,64,16,0.21989244806709973,32,5,0.0023385794433400057,ce,PRUNED
